{
  "$schema": "https://json-schema.org/draft/2020-12/schema",
  "$id": "https://openclaw-videofactory.local/schemas/video_workflow/quality_report.schema.json",
  "title": "Quality Report",
  "type": "object",
  "required": [
    "report_id",
    "job_id",
    "checks",
    "decision",
    "source",
    "provenance",
    "status",
    "schema_version"
  ],
  "properties": {
    "report_id": {
      "type": "string"
    },
    "job_id": {
      "type": "string"
    },
    "checks": {
      "type": "array",
      "items": {
        "type": "object",
        "required": [
          "name",
          "passed"
        ],
        "properties": {
          "name": {
            "type": "string",
            "enum": [
              "resolution",
              "fps",
              "audio_level",
              "subtitle_sync",
              "copyright",
              "brand_compliance",
              "structure_ratio",
              "hook_first_2s"
            ]
          },
          "passed": {
            "type": "boolean"
          },
          "detail": {
            "type": "string"
          }
        }
      }
    },
    "decision": {
      "type": "string",
      "enum": [
        "pass",
        "fail",
        "human_review"
      ]
    },
    "self_review_pass": {
      "type": "integer",
      "minimum": 0,
      "maximum": 3
    },
    "schema_version": {
      "type": "string",
      "const": "1.0"
    },
    "source": {
      "type": "object",
      "required": [
        "kind",
        "id"
      ],
      "properties": {
        "kind": {
          "type": "string",
          "enum": [
            "openclaw_skill",
            "provider_adapter",
            "human",
            "platform",
            "synthetic_fixture"
          ]
        },
        "id": {
          "type": "string"
        },
        "version": {
          "type": "string"
        }
      }
    },
    "provenance": {
      "type": "object",
      "properties": {
        "created_at": {
          "type": "string",
          "format": "date-time"
        },
        "created_by": {
          "type": "string"
        },
        "tool": {
          "type": "string"
        }
      }
    },
    "status": {
      "type": "string",
      "enum": [
        "draft",
        "active",
        "rejected",
        "superseded",
        "deprecated"
      ]
    },
    "confidence": {
      "type": "number",
      "minimum": 0,
      "maximum": 1
    },
    "validation_errors": {
      "type": "array",
      "items": {
        "type": "string"
      },
      "default": []
    }
  },
  "additionalProperties": false
}