{
  "report_id": "qr_0",
  "job_id": "job_0",
  "checks": [
    {
      "name": "resolution",
      "passed": true
    },
    {
      "name": "subtitle_sync",
      "passed": true
    }
  ],
  "decision": "pass",
  "self_review_pass": 1,
  "schema_version": "1.0",
  "source": {
    "kind": "synthetic_fixture",
    "id": "v28-test"
  },
  "provenance": {
    "created_at": "2026-07-30T07:18:14.500889+00:00",
    "created_by": "test",
    "tool": "v28_schema_tests"
  },
  "status": "active",
  "confidence": 0.9
}